Text,Company,Rating
"The cloud infrastructure rollout was flawless. Zero downtime and everything scaled perfectly on day one. A true enterprise solution.",Microsoft,5
"Salesforce's CRM platform is indispensable for our sales team, but the cost of add-ons quickly spirals out of control.",Salesforce,4
"Their customer support for a minor billing issue was absolutely abysmal. Took 4 different transfers and two weeks to resolve.",Google,1
"Adobe Creative Cloud is the industry standard for a reason. Always reliable and the new features are a game-changer for our design team.",Adobe,5
"Zoom's video quality is excellent, even with a large number of participants. The meeting management features are intuitive.",Zoom,5
"HubSpot's marketing automation tools are powerful, but the learning curve for a small team is much steeper than advertised.",HubSpot,3
"N-iX delivered our custom mobile app ahead of schedule and under budget. High technical competency and excellent project management.",N-iX,5
"VLink's managed IT services have stabilized our network. We've seen a 40% reduction in system failures since switching.",VLink,5
"Accedia's consulting team helped us define a clear digital transformation roadmap. Their industry knowledge was invaluable.",Accedia,4
"TruAdvantage's cybersecurity audit was thorough and exposed critical vulnerabilities we weren't aware of. Peace of mind restored.",TruAdvantage,5
"The latest Microsoft update caused a major conflict with our legacy accounting software. It took days for a patch to be issued.",Microsoft,2
"We were overcharged for a feature we never used. Getting a refund from Salesforce was a bureaucratic nightmare.",Salesforce,1
"Google's Workspace collaboration tools are the backbone of our remote operations. Seamless integration across all devices.",Google,5
"Subscription pricing for Adobe is fair, but their licensing model across multiple users is overly complicated.",Adobe,3
"Zoom's free tier is a lifesaver for small non-profits. Functionality is fantastic for the price.",Zoom,5
"HubSpot's reporting dashboard is not as customizable as we need it to be. Lacks depth for advanced analytics.",HubSpot,3
"The N-iX development team was responsive and adapted quickly to our changing project requirements. Very agile.",N-iX,5
"VLink's helpdesk response time is consistently slow during peak hours. Need more staff to handle tickets faster.",VLink,2
"Accedia's offshore resources integrated well with our internal team. No communication issues and strong work ethic.",Accedia,4
"TruAdvantage's proactive monitoring caught a hardware failure before it impacted our business. Great service!",TruAdvantage,5
"Microsoft Azure has provided the scalability we desperately needed for our expanding data needs. Excellent platform.",Microsoft,5
"Salesforce's user interface feels outdated and clunky compared to newer CRM competitors. Needs a refresh.",Salesforce,3
"We switched all our productivity suites to Google and haven't looked back. Highly reliable and cost-effective.",Google,5
"A critical bug in the latest Adobe Illustrator update froze my system multiple times. Unacceptable for a professional tool.",Adobe,1
"The Zoom Room setup was easy and works flawlessly in all our conference rooms. A very polished product.",Zoom,5
"HubSpot's customer success manager provides personalized guidance and helps us optimize our campaigns monthly.",HubSpot,5
"The initial scoping phase with N-iX took longer than anticipated, but the end result was worth the wait.",N-iX,4
"VLink overpromised on their implementation timeline. The project was delayed by three weeks with little communication.",VLink,2
"Accedia's solution was overly generic for our niche industry. We had to do significant customization ourselves.",Accedia,2
"TruAdvantage's team is extremely knowledgeable about compliance standards. They guided us through a complex audit.",TruAdvantage,5
"Microsoft's enterprise support is incredibly efficient. Issues are owned and resolved with professionalism.",Microsoft,5
"Salesforce's documentation is vast and often difficult to navigate. Finding simple answers requires too much searching.",Salesforce,3
"The security features on Google Cloud Platform are top-tier. We feel very secure hosting our sensitive data there.",Google,5
"I dislike the mandatory updates for Adobe products; they often interrupt workflow at the worst possible time.",Adobe,2
"We had connection issues with Zoom during a very important investor pitch. Embarrassing and unreliable.",Zoom,1
"HubSpot is the single best tool for inbound marketing. Simplified our entire lead generation process.",HubSpot,5
"Our long-term partnership with N-iX has been key to our technological growth. Truly a strategic partner.",N-iX,5
"VLink's pricing structure is complex and hard to compare with other managed service providers.",VLink,3
"Accedia's delivery manager was excellent at keeping the project on track and communicating risks transparently.",Accedia,4
"TruAdvantage's response to a security incident was fast and effective. Minimal damage thanks to their speed.",TruAdvantage,5
"Microsoft Teams is an absolute mess. Constant glitches and poor integration with Outlook compared to competitors.",Microsoft,1
"We love the automation capabilities of Salesforce. It handles complex workflows easily.",Salesforce,4
"Google Meet is good, but lacks some of the advanced features of competing video platforms.",Google,3
"Adobe's mobile apps are a fantastic extension of their desktop suite. True cross-platform functionality.",Adobe,4
"Zoom webinars are easy to set up and manage, even for large-scale events. Highly scalable.",Zoom,5
"HubSpot's email builder is very intuitive and generates clean, professional-looking campaigns.",HubSpot,4
"N-iX provided excellent QA services, catching critical bugs before launch. Their attention to detail is high.",N-iX,5
"The monthly fees from VLink are too high for the level of service we are receiving. Considering other options.",VLink,2
"Accedia's final product exceeded our expectations for quality and performance. Great value for the cost.",Accedia,5
"TruAdvantage is simply the best in IT security. No vendor comes close to their expertise.",TruAdvantage,5
"The cost of a full Microsoft Dynamics 365 implementation was much higher than initially quoted.",Microsoft,3
"Salesforce's support for smaller business accounts is clearly prioritized lower than enterprise customers.",Salesforce,2
"Google's AI tools integrated into their products are incredibly helpful for data analysis.",Google,5
"The performance of Adobe's software is a resource hog. My high-end machine struggles with large files.",Adobe,2
"Zoom's constant security updates are annoying but necessary, I suppose.",Zoom,3
"HubSpot's free CRM is an incredible starting point for startups and small businesses.",HubSpot,5
"N-iX's engineers are true experts in their field. The solution they built is robust and future-proof.",N-iX,5
"VLink failed to migrate our data correctly, leading to several days of recovery work.",VLink,1
"We hired Accedia for a staff augmentation project; the resources provided were mid-level, not senior as promised.",Accedia,2
"TruAdvantage's managed backup solution has saved us once already. Worth every penny.",TruAdvantage,5
"Microsoft Word and Excel remain the gold standard for office productivity. Unbeatable tools.",Microsoft,5
"Salesforce has so many features we don't use, it makes the interface cluttered and overwhelming.",Salesforce,3
"Google Docs collaboration feature is revolutionary. Makes real-time co-authoring a breeze.",Google,5
"Adobe Premiere Pro is still crashing on a weekly basis despite numerous bug fixes. Frustrating!",Adobe,1
"Zoom's audio echo cancellation is the best in the business. Clear calls every time.",Zoom,5
"The integration between HubSpot's Sales and Marketing hubs is seamless and very effective.",HubSpot,5
"N-iX is not the cheapest provider, but the quality of their code and service justifies the price.",N-iX,4
"VLink's sales process was aggressive and misleading about the true capabilities of their system.",VLink,1
"Accedia helped us optimize our database for massive performance gains. Very satisfied with the outcome.",Accedia,5
"TruAdvantage's team is always available, even for late-night emergency calls. Exceptional support.",TruAdvantage,5
"Microsoft's licensing portal is a maze of complexity. Hard to manage and track user seats.",Microsoft,2
"Salesforce has too much vendor lock-in. Switching to another CRM feels impossible now.",Salesforce,4
"The value proposition of Google Workspace for our large company is simply unmatched in the market.",Google,5
"Adobe Stock integration within the Creative Cloud saves us so much time and effort searching for assets.",Adobe,5
"Zoom fatigue is real, but the platform itself performs admirably under pressure.",Zoom,4
"HubSpot's website CMS is a dream to work with. Very powerful and easy for non-developers.",HubSpot,5
"We encountered significant scope creep with N-iX; they need to improve their initial estimates.",N-iX,3
"VLink's consultant was friendly and knowledgeable, but the solutions proposed were too expensive for our budget.",VLink,3
"Accedia's cultural fit with our organization was great. They felt like an extension of our own team.",Accedia,5
"TruAdvantage's security training for our staff was engaging and very informative. A crucial service.",TruAdvantage,4
"We are locked into the Microsoft ecosystem for life, and it's a blessing and a curse. Great tech, poor vendor experience.",Microsoft,4
"Salesforce has too many unnecessary features. It's overwhelming for a small team.",Salesforce,2
"Google Photos provides unlimited cloud storage and is the only thing keeping our memories safe.",Google,5
"Adobe Photoshop is the gold standard, but the price is too high for casual users.",Adobe,4
"Zoom's background features are fun, but the constant feature bloat is starting to slow the app down.",Zoom,3
"HubSpot's reporting is excellent, providing clear insight into what campaigns are actually working.",HubSpot,5
"N-iX's project manager was consistently late in providing status updates. Communication needs work.",N-iX,2
"VLink resolved a major server failure over the weekend. Their 24/7 service is truly reliable.",VLink,5
"Accedia's developers are technically brilliant, but their soft skills could use some improvement.",Accedia,3
"We trust TruAdvantage implicitly with our company's entire network security. They are the best partner.",TruAdvantage,5
"Microsoft's constant push to use Edge over other browsers is an annoying anti-competitive tactic.",Microsoft,1
"Salesforce automation saved our team countless hours in manual data entry. Highly recommend the platform.",Salesforce,5
"Google Maps API integration for our delivery system was incredibly easy and performant.",Google,5
"Adobe Acrobat Pro is the only PDF editor worth using. Indispensable for business documentation.",Adobe,5
"Zoom's transcription service is highly accurate and a huge help for meeting minutes.",Zoom,5
"HubSpot is fantastic for lead nurturing and its pipeline management is very visual and easy to use.",HubSpot,4
"N-iX provided a cost-effective solution without compromising on quality. A rare find.",N-iX,5
"VLink took over 48 hours to respond to a critical severity ticket. Very poor service management.",VLink,1
"Accedia's expertise in obscure legacy systems was a lifesaver for our modernization project.",Accedia,5
"TruAdvantage is proactive in suggesting improvements to our IT infrastructure, not just fixing broken things.",TruAdvantage,5
"The cost of Microsoft's Power BI tool is prohibitive for our mid-sized business.",Microsoft,3
"Salesforce's Einstein AI is a powerful tool for forecasting and data analysis. Great feature set.",Salesforce,4
"We use Google Sheets for all internal tracking; the simultaneous editing feature is perfect.",Google,5
"Adobe's subscription model is much better than the old perpetual license. Constant updates and features.",Adobe,5
"Zoom's recording quality is inconsistent, especially when recording in the cloud.",Zoom,2
"HubSpot's free tools are a bit too restrictive; they force you into a paid plan quickly.",HubSpot,3
"The N-iX team truly understands our business goals, leading to a perfectly tailored product.",N-iX,5
"VLink's technician was rude and unhelpful when dealing with a hardware issue on-site.",VLink,1
"Accedia's project delivery was delayed due to internal resource scheduling issues on their end.",Accedia,2
"TruAdvantage provides excellent value for money with their all-inclusive managed security package.",TruAdvantage,5
"Microsoft Exchange Online is reliable and handles our email volume without issue. Solid infrastructure.",Microsoft,5
"Salesforce's mobile app is poorly designed and lacks the functionality of the desktop version.",Salesforce,2
"Google's 2FA on their accounts is robust and easy to set up. Very good security practice.",Google,5
"I wish Adobe offered more flexible payment plans for freelancers and smaller creative studios.",Adobe,3
"Zoom is great for one-on-one calls, but performance dips significantly in very large group meetings.",Zoom,3
"HubSpot's reporting feature is too basic; we have to export data to Excel for any deep analysis.",HubSpot,2
"N-iX is our go-to partner for complex backend development. They are the best we've worked with.",N-iX,5
"VLink successfully migrated our entire server room to the cloud in a single weekend. Impressive work!",VLink,5
"Accedia's final proposal included a lot of unnecessary services we didn't ask for. Felt like an up-sell.",Accedia,2
"TruAdvantage's disaster recovery plan passed our stress test with flying colors. A very reassuring experience.",TruAdvantage,5
"Microsoft Defender is a powerful security suite, but it constantly flags legitimate internal software.",Microsoft,3
"Salesforce's community forums are an excellent resource for finding solutions and help.",Salesforce,4
"Google Chrome is fast, but its memory usage is absolutely excessive.",Google,4
"The integration of Adobe Fonts and libraries is flawless, making brand consistency easy.",Adobe,5
"Zoom's continuous innovation with new features keeps it ahead of its competitors.",Zoom,5
"HubSpot's free onboarding resources and support are top-tier, even for their entry-level plans.",HubSpot,5